{
  "schemaVersion": 1,
  "puzzleId": "app-owner-2026-11-12-es-419",
  "puzzleFamilyId": "app-owner-001",
  "locale": "es-419",
  "publishDate": "2026-11-12",
  "timezone": "UTC",
  "theme": "Apps y sus dueños",
  "items": [
    {
      "itemId": "app-owner-1",
      "label": "Instagram"
    },
    {
      "itemId": "app-owner-2",
      "label": "WhatsApp"
    },
    {
      "itemId": "app-owner-3",
      "label": "GitHub"
    },
    {
      "itemId": "app-owner-4",
      "label": "Twitch"
    },
    {
      "itemId": "app-owner-5",
      "label": "Gmail"
    },
    {
      "itemId": "app-owner-6",
      "label": "Google Maps"
    },
    {
      "itemId": "app-owner-7",
      "label": "YouTube"
    },
    {
      "itemId": "app-owner-8",
      "label": "LinkedIn"
    },
    {
      "itemId": "app-owner-9",
      "label": "Facebook"
    },
    {
      "itemId": "app-owner-10",
      "label": "Android"
    }
  ],
  "rows": [
    {
      "rowId": "row-1",
      "capacity": 1
    },
    {
      "rowId": "row-2",
      "capacity": 2
    },
    {
      "rowId": "row-3",
      "capacity": 3
    },
    {
      "rowId": "row-4",
      "capacity": 4
    }
  ],
  "solution": {
    "hiddenDimension": "La empresa dueña de la app",
    "groups": [
      {
        "groupId": "g1",
        "label": "Amazon",
        "capacity": 1,
        "itemIds": [
          "app-owner-4"
        ]
      },
      {
        "groupId": "g2",
        "label": "Microsoft",
        "capacity": 2,
        "itemIds": [
          "app-owner-8",
          "app-owner-3"
        ]
      },
      {
        "groupId": "g3",
        "label": "Meta Platforms",
        "capacity": 3,
        "itemIds": [
          "app-owner-9",
          "app-owner-1",
          "app-owner-2"
        ]
      },
      {
        "groupId": "g4",
        "label": "Google",
        "capacity": 4,
        "itemIds": [
          "app-owner-7",
          "app-owner-5",
          "app-owner-6",
          "app-owner-10"
        ]
      }
    ]
  },
  "hint": {
    "maxUses": 1,
    "policy": "random-unlocked-correct-row"
  },
  "explanation": "Cada grupo pertenece a una empresa: 1 app de Amazon, 2 de Microsoft, 3 de Meta y 4 de Google.",
  "sources": [
    {
      "title": "Wikipedia: Meta Platforms",
      "url": "https://en.wikipedia.org/wiki/Meta_Platforms",
      "retrievedAt": "2026-10-03"
    },
    {
      "title": "Wikipedia: Alphabet Inc.",
      "url": "https://en.wikipedia.org/wiki/Alphabet_Inc.",
      "retrievedAt": "2026-10-03"
    }
  ],
  "difficulty": {
    "band": "medium",
    "score": 0.45
  },
  "status": "scheduled"
}
