{
  "schemaVersion": 1,
  "puzzleId": "tree-type-2026-09-23-zh-hant",
  "puzzleFamilyId": "tree-type-001",
  "locale": "zh-Hant",
  "publishDate": "2026-09-23",
  "timezone": "UTC",
  "theme": "樹木",
  "items": [
    {"itemId": "tree-palm", "label": "棕櫚樹"},
    {"itemId": "tree-pine", "label": "松樹"},
    {"itemId": "tree-fir", "label": "冷杉"},
    {"itemId": "tree-oak", "label": "橡樹"},
    {"itemId": "tree-maple", "label": "楓樹"},
    {"itemId": "tree-birch", "label": "樺樹"},
    {"itemId": "tree-apple", "label": "蘋果樹"},
    {"itemId": "tree-orange", "label": "柳橙樹"},
    {"itemId": "tree-cherry", "label": "櫻桃樹"},
    {"itemId": "tree-mango", "label": "芒果樹"}
  ],
  "rows": [
    {"rowId": "row-1", "capacity": 1},
    {"rowId": "row-2", "capacity": 2},
    {"rowId": "row-3", "capacity": 3},
    {"rowId": "row-4", "capacity": 4}
  ],
  "solution": {
    "hiddenDimension": "常見聯想",
    "groups": [
      {"groupId": "g1", "label": "熱帶／海灘", "capacity": 1, "itemIds": ["tree-palm"]},
      {"groupId": "g2", "label": "聖誕樹", "capacity": 2, "itemIds": ["tree-pine", "tree-fir"]},
      {"groupId": "g3", "label": "森林", "capacity": 3, "itemIds": ["tree-oak", "tree-maple", "tree-birch"]},
      {"groupId": "g4", "label": "果園", "capacity": 4, "itemIds": ["tree-apple", "tree-orange", "tree-cherry", "tree-mango"]}
    ]
  },
  "hint": {"maxUses": 1, "policy": "random-unlocked-correct-row"},
  "explanation": "每組樹木都與一種常見場景或聯想相關：1 棵熱帶／海灘樹、2 棵聖誕樹、3 棵森林樹和 4 棵果園樹。",
  "sources": [
    {"title": "大英百科全書：樹", "url": "https://www.britannica.com/plant/tree", "retrievedAt": "2026-08-29"}
  ],
  "difficulty": {"band": "medium", "score": 0.39},
  "status": "scheduled"
}
